{
  "reference_library_id": "reference_library_luna_fit",
  "creator_profile_id": "creator_luna_fit",
  "created_on": "2026-06-29",
  "asset_root": "references/",
  "assets": [
    {
      "asset_id": "asset_luna_identity_plate",
      "asset_type": "character",
      "asset_status": "generated",
      "role": "Primary character identity plate",
      "path": "references/character/luna-identity-plate.png",
      "source": {
        "source_type": "generated",
        "source_ref": "sources/intakes/luna-fit-breakdown.md"
      },
      "created_on": "2026-06-29",
      "usage_notes": "Use to preserve face, age, skin texture, expression baseline, and identity continuity.",
      "semantic_index_allowed": false
    },
    {
      "asset_id": "asset_luna_living_room",
      "asset_type": "location",
      "asset_status": "generated",
      "role": "Recurring warm apartment living room",
      "path": "references/locations/luna-living-room-master-location-sheet.png",
      "selection_candidate_id": "continuity_candidate_luna_living_room",
      "source": {
        "source_type": "generated",
        "source_ref": "sources/intakes/luna-fit-breakdown.md"
      },
      "created_on": "2026-06-29",
      "usage_notes": "Use as the reusable creator-space reference for apartment routines and talking-head scenes.",
      "semantic_index_allowed": false
    },
    {
      "asset_id": "asset_luna_living_room_wall",
      "asset_type": "location",
      "asset_status": "generated",
      "role": "Clear living-room wall demonstration space",
      "path": "references/locations/luna-fit-living-room-wall.png",
      "selection_candidate_id": "continuity_candidate_luna_living_room_wall",
      "source": {
        "source_type": "generated",
        "source_ref": "sources/intakes/luna-fit-breakdown.md"
      },
      "created_on": "2026-06-29",
      "usage_notes": "Use for full-body standing and wall-supported demonstrations.",
      "semantic_index_allowed": false
    },
    {
      "asset_id": "asset_luna_reset_timer",
      "asset_type": "object",
      "asset_status": "generated",
      "role": "Signature matte two-minute reset timer",
      "path": "references/objects/luna-fit-reset-timer.png",
      "selection_candidate_id": "continuity_candidate_luna_reset_timer",
      "source": {
        "source_type": "generated",
        "source_ref": "sources/intakes/luna-fit-breakdown.md"
      },
      "created_on": "2026-06-29",
      "usage_notes": "Use as the recurring visible cue for Luna's two-minute reset promise.",
      "semantic_index_allowed": false
    },
    {
      "asset_id": "asset_luna_everyday_outfit",
      "asset_type": "outfit",
      "asset_status": "prompted",
      "role": "Primary everyday athleisure outfit reference",
      "path": "references/outfits/luna-everyday-outfit.png",
      "prompt_path": "references/outfits/luna-everyday-outfit.prompt.md",
      "source": {
        "source_type": "derived",
        "source_ref": "sources/intakes/luna-fit-breakdown.md"
      },
      "created_on": "2026-06-29",
      "usage_notes": "Use to keep wardrobe continuity across routine and reset videos; generation stays gated until the exact call is approved.",
      "semantic_index_allowed": false
    },
    {
      "asset_id": "asset_luna_brand_system",
      "asset_type": "brand",
      "asset_status": "prompted",
      "role": "Brand and visual system reference",
      "path": "references/brand/luna-brand-system.png",
      "prompt_path": "references/brand/luna-brand-system.prompt.md",
      "source": {
        "source_type": "derived",
        "source_ref": "brand_context/personal-brand.md"
      },
      "created_on": "2026-06-29",
      "usage_notes": "Use for palette, type, overlay, and end-card continuity across posts and sequences.",
      "semantic_index_allowed": true
    },
    {
      "asset_id": "asset_luna_default_video_style",
      "asset_type": "video_style",
      "asset_status": "approved",
      "role": "Default phone-first vertical creator style",
      "path": "references/video-style/default-video-photo-style.md",
      "prompt_path": "references/video-style/default-video-photo-style.prompt.md",
      "source": {
        "source_type": "derived",
        "source_ref": "brand_context/personal-brand.md"
      },
      "created_on": "2026-06-29",
      "usage_notes": "Use for @video_style_reference: camera source, lens feel, aspect ratio, lighting, framing defaults, movement feel, shot quality, recurring shot families, and social-native finish.",
      "semantic_index_allowed": true
    },
    {
      "asset_id": "asset_luna_elevenlabs_voice_design",
      "asset_type": "voice",
      "asset_status": "prompted",
      "role": "ElevenLabs Voice Design prompt for synthetic spoken voice continuity",
      "path": "references/voice/luna-fit-elevenlabs-voice-design.prompt.md",
      "prompt_path": "references/voice/luna-fit-elevenlabs-voice-design.prompt.md",
      "source": {
        "source_type": "derived",
        "source_ref": "brand_context/voice-samples.md"
      },
      "created_on": "2026-06-29",
      "usage_notes": "Use as the human-in-the-loop prompt package for manual ElevenLabs Voice Design. This is not generated audio and does not approve provider calls.",
      "semantic_index_allowed": true
    }
  ],
  "usage_policy": {
    "identity_assets_required_for_generation": true,
    "provider_calls_require_approval": true,
    "raw_media_git_policy": "Real creator references and generated media stay under workspace-library and must not be committed."
  }
}
